id;title;memo;start;end;type_id;deal_id;contact_id;app_account_id;agent_id;done
681;magna vestibulum aliquet ultrices erat tortor sollicitudin mi sit;metus vitae ipsum aliquam non;2018-01-01T00:00:00;2018-01-06T00:00:00;4;717;713;7;74;FALSE
682;in hac habitasse platea dictumst morbi vestibulum velit;vestibulum sit amet cursus id;2018-01-03T00:00:00;2018-01-11T00:00:00;5;756;765;7;70;FALSE
683;lobortis est phasellus sit amet erat nulla;eu orci mauris lacinia;2018-01-01T00:00:00;2018-01-08T00:00:00;5;916;944;9;93;FALSE
684;elementum in hac habitasse platea dictumst morbi;mauris morbi non lectus aliquam;2018-01-02T00:00:00;2018-01-06T00:00:00;2;847;823;8;80;FALSE
685;platea dictumst aliquam augue quam sollicitudin vitae;sed magna;2018-01-01T00:00:00;2018-01-06T00:00:00;5;657;603;6;61;FALSE
686;arcu libero rutrum ac lobortis vel dapibus at;nisl aenean lectus pellentesque;2018-01-01T00:00:00;2018-01-09T00:00:00;3;489;405;4;44;FALSE
687;vel pede morbi porttitor lorem id ligula;mi sit amet lobortis sapien sapien;2018-01-01T00:00:00;2018-01-09T00:00:00;3;633;639;6;60;FALSE
688;mauris enim leo rhoncus sed vestibulum sit amet cursus id turpis integer aliquet massa;primis in;2018-01-01T00:00:00;2018-01-06T00:00:00;5;873;807;8;83;FALSE
689;quisque id justo sit amet sapien dignissim vestibulum vestibulum ante ipsum primis in;a pede posuere nonummy;2018-01-04T00:00:00;2018-01-09T00:00:00;3;876;853;8;82;FALSE
690;eleifend pede libero quis orci nullam molestie nibh in lectus pellentesque at nulla suspendisse;pede malesuada in;2018-01-02T00:00:00;2018-01-07T00:00:00;4;960;967;9;93;FALSE
691;sit amet sem fusce consequat nulla nisl nunc nisl duis;nulla neque libero convallis;2018-01-04T00:00:00;2018-01-07T00:00:00;5;410;405;4;41;FALSE
692;pretium quis lectus suspendisse potenti in eleifend;nec nisi vulputate;2018-01-01T00:00:00;2018-01-06T00:00:00;4;237;249;2;22;FALSE
693;mauris eget massa tempor convallis nulla neque libero convallis eget eleifend;augue vel accumsan tellus nisi;2018-01-02T00:00:00;2018-01-11T00:00:00;2;207;294;2;21;FALSE
694;eros elementum pellentesque quisque porta volutpat erat quisque erat eros;ut odio cras mi pede;2018-01-03T00:00:00;2018-01-09T00:00:00;3;347;356;3;30;FALSE
695;tincidunt lacus at velit vivamus vel nulla eget eros elementum;in leo maecenas pulvinar lobortis est;2018-01-01T00:00:00;2018-01-09T00:00:00;4;336;395;3;33;FALSE
696;volutpat sapien arcu sed augue;ipsum integer a;2018-01-03T00:00:00;2018-01-09T00:00:00;4;104;108;1;13;FALSE
697;pellentesque ultrices phasellus id sapien in sapien iaculis congue vivamus metus arcu;eget massa;2018-01-01T00:00:00;2018-01-11T00:00:00;5;540;526;5;51;FALSE
698;vitae mattis nibh ligula nec sem duis;id pretium iaculis diam erat;2018-01-04T00:00:00;2018-01-10T00:00:00;1;436;472;4;43;FALSE
699;est phasellus sit amet erat nulla tempus vivamus in felis eu sapien cursus;mauris vulputate;2018-01-01T00:00:00;2018-01-11T00:00:00;4;745;711;7;70;FALSE
700;at dolor quis odio consequat varius integer ac leo pellentesque ultrices;phasellus sit amet erat nulla;2018-01-03T00:00:00;2018-01-09T00:00:00;5;294;270;2;22;FALSE
701;semper sapien a libero;sed interdum venenatis turpis enim;2018-01-02T00:00:00;2018-01-07T00:00:00;5;864;817;8;81;FALSE
702;suspendisse potenti in eleifend;ante vel;2018-01-02T00:00:00;2018-01-10T00:00:00;1;134;101;1;10;FALSE
703;ac neque duis bibendum morbi non quam nec dui luctus rutrum nulla tellus in sagittis;nisl venenatis;2018-01-03T00:00:00;2018-01-09T00:00:00;1;948;926;9;90;FALSE
704;velit vivamus vel nulla eget eros elementum pellentesque quisque porta;lobortis sapien sapien non mi;2018-01-02T00:00:00;2018-01-08T00:00:00;5;603;648;6;63;FALSE
705;justo maecenas rhoncus aliquam lacus morbi quis tortor id nulla ultrices aliquet maecenas leo;ipsum primis;2018-01-01T00:00:00;2018-01-07T00:00:00;4;265;293;2;21;FALSE
706;aliquam non mauris morbi non lectus;porta volutpat;2018-01-01T00:00:00;2018-01-11T00:00:00;5;691;622;6;64;TRUE
707;sapien placerat ante nulla justo;posuere cubilia curae donec pharetra;2018-01-01T00:00:00;2018-01-10T00:00:00;5;230;228;2;21;TRUE
708;velit donec diam neque vestibulum eget vulputate ut ultrices vel augue vestibulum ante ipsum;nulla integer pede justo lacinia;2018-01-02T00:00:00;2018-01-06T00:00:00;1;944;966;9;93;TRUE
709;eu magna vulputate luctus cum sociis natoque penatibus et magnis dis;ipsum primis in faucibus orci;2018-01-02T00:00:00;2018-01-10T00:00:00;4;556;515;5;52;TRUE
710;erat nulla tempus vivamus;augue luctus tincidunt nulla;2018-01-04T00:00:00;2018-01-06T00:00:00;5;830;823;8;81;TRUE
711;mauris vulputate elementum nullam varius nulla facilisi cras;penatibus et magnis;2018-01-04T00:00:00;2018-01-11T00:00:00;5;223;285;2;22;TRUE
712;a odio in hac habitasse platea dictumst maecenas ut massa quis augue luctus tincidunt;risus praesent lectus vestibulum;2018-01-03T00:00:00;2018-01-09T00:00:00;4;662;695;6;63;TRUE
713;rutrum nulla tellus in sagittis dui vel nisl duis ac nibh fusce;parturient montes nascetur;2018-01-03T00:00:00;2018-01-11T00:00:00;5;577;503;5;53;TRUE
714;pede justo lacinia eget tincidunt eget tempus vel pede morbi porttitor lorem id ligula suspendisse;fusce posuere felis sed lacus;2018-01-02T00:00:00;2018-01-10T00:00:00;2;749;772;7;71;TRUE
715;faucibus cursus urna ut tellus;libero nullam sit amet;2018-01-03T00:00:00;2018-01-11T00:00:00;5;597;582;5;52;TRUE
716;nonummy integer non velit;lobortis ligula sit amet;2018-01-01T00:00:00;2018-01-11T00:00:00;4;422;498;4;42;TRUE
717;justo pellentesque viverra pede;arcu libero rutrum ac lobortis vel;2018-01-03T00:00:00;2018-01-11T00:00:00;5;690;620;6;62;TRUE
718;fusce posuere felis sed lacus morbi sem mauris laoreet ut rhoncus aliquet pulvinar sed;imperdiet sapien;2018-01-03T00:00:00;2018-01-10T00:00:00;3;156;183;1;11;TRUE
719;semper porta volutpat quam pede lobortis ligula;penatibus et magnis dis parturient;2018-01-02T00:00:00;2018-01-11T00:00:00;4;887;805;8;81;TRUE
720;in porttitor pede justo;ipsum primis in;2018-01-03T00:00:00;2018-01-11T00:00:00;5;992;996;9;91;TRUE
721;diam in magna bibendum imperdiet nullam orci pede venenatis non;sodales sed tincidunt eu felis fusce;2018-01-02T00:00:00;2018-01-06T00:00:00;5;654;626;6;62;TRUE
722;tristique in tempus sit amet sem fusce consequat nulla nisl nunc nisl duis bibendum;id nulla ultrices aliquet maecenas;2018-01-03T00:00:00;2018-01-06T00:00:00;5;456;469;4;43;TRUE
723;mattis nibh ligula nec sem duis aliquam convallis nunc proin at turpis a pede;risus praesent lectus;2018-01-02T00:00:00;2018-01-10T00:00:00;5;420;452;4;41;TRUE
724;orci nullam molestie nibh in lectus pellentesque at nulla suspendisse potenti;ultrices libero non mattis pulvinar nulla;2018-01-02T00:00:00;2018-01-06T00:00:00;4;513;534;5;52;TRUE
725;sapien varius ut blandit non interdum in ante;consequat lectus in est risus;2018-01-01T00:00:00;2018-01-07T00:00:00;5;483;486;4;42;TRUE
726;primis in faucibus orci luctus;id luctus nec molestie;2018-01-04T00:00:00;2018-01-10T00:00:00;5;452;419;4;43;TRUE
727;in tempus sit amet sem;lectus vestibulum;2018-01-04T00:00:00;2018-01-09T00:00:00;4;888;806;8;81;TRUE
728;aenean sit amet justo morbi;quisque id justo sit amet;2018-01-02T00:00:00;2018-01-11T00:00:00;2;995;935;9;92;TRUE
729;nascetur ridiculus mus etiam vel augue vestibulum rutrum rutrum neque aenean auctor gravida;semper sapien a;2018-01-03T00:00:00;2018-01-09T00:00:00;4;689;687;6;64;TRUE
730;risus auctor sed tristique in tempus sit;mi sit amet;2018-01-01T00:00:00;2018-01-08T00:00:00;4;467;433;4;42;TRUE
731;augue vestibulum rutrum rutrum neque aenean auctor gravida sem praesent id massa id nisl venenatis;mattis pulvinar;2018-01-04T00:00:00;2018-01-09T00:00:00;5;549;598;5;50;TRUE
732;congue etiam justo etiam;nulla quisque arcu libero;2018-01-04T00:00:00;2018-01-11T00:00:00;5;595;511;5;54;TRUE
733;tortor duis mattis egestas metus aenean fermentum donec ut mauris eget massa tempor;dis parturient montes nascetur ridiculus mus;2018-01-02T00:00:00;2018-01-06T00:00:00;5;154;141;1;12;TRUE
734;sollicitudin mi sit amet lobortis sapien sapien non mi integer ac neque duis bibendum;enim sit amet nunc;2018-01-03T00:00:00;2018-01-08T00:00:00;5;246;205;2;21;TRUE
735;blandit ultrices enim lorem ipsum dolor sit amet consectetuer adipiscing elit proin interdum mauris;vestibulum rutrum rutrum neque aenean;2018-01-01T00:00:00;2018-01-10T00:00:00;5;389;375;3;34;TRUE
736;adipiscing molestie hendrerit at vulputate vitae nisl aenean lectus pellentesque eget nunc donec quis orci;rutrum nulla;2018-01-01T00:00:00;2018-01-08T00:00:00;5;179;147;1;12;TRUE
737;in hac habitasse platea dictumst aliquam;at vulputate vitae nisl;2018-01-01T00:00:00;2018-01-08T00:00:00;4;741;785;7;73;TRUE
738;morbi ut odio cras mi pede malesuada in imperdiet et commodo vulputate justo in;cubilia curae donec;2018-01-03T00:00:00;2018-01-07T00:00:00;3;643;656;6;60;TRUE
739;imperdiet et commodo vulputate justo in blandit ultrices enim lorem ipsum;consequat in consequat;2018-01-01T00:00:00;2018-01-11T00:00:00;5;872;834;8;80;TRUE
740;in felis donec semper sapien a;non sodales;2018-01-01T00:00:00;2018-01-10T00:00:00;5;375;310;3;30;TRUE
741;duis bibendum felis sed interdum venenatis turpis enim blandit mi in porttitor pede justo;montes nascetur ridiculus mus etiam;2018-01-03T00:00:00;2018-01-11T00:00:00;4;444;427;4;42;TRUE
742;sem fusce consequat nulla nisl nunc nisl duis bibendum felis;phasellus id sapien in;2018-01-03T00:00:00;2018-01-09T00:00:00;5;732;761;7;73;TRUE
743;est risus auctor sed tristique in;quis turpis sed ante vivamus;2018-01-03T00:00:00;2018-01-06T00:00:00;5;278;213;2;24;TRUE
744;amet sem fusce consequat nulla nisl nunc nisl duis bibendum felis sed interdum venenatis turpis;nisi volutpat eleifend donec;2018-01-04T00:00:00;2018-01-08T00:00:00;4;163;115;1;12;TRUE
745;dapibus duis at velit eu est congue elementum in;nunc donec quis orci eget orci;2018-01-04T00:00:00;2018-01-11T00:00:00;4;711;784;7;73;TRUE
746;ultrices posuere cubilia curae nulla dapibus dolor vel est donec odio justo sollicitudin;diam cras pellentesque;2018-01-04T00:00:00;2018-01-07T00:00:00;3;632;609;6;64;TRUE
747;leo maecenas pulvinar lobortis est phasellus sit amet erat nulla tempus vivamus in;non quam nec dui;2018-01-01T00:00:00;2018-01-10T00:00:00;4;688;667;6;60;TRUE
748;id mauris vulputate elementum nullam varius nulla facilisi cras;mi in porttitor;2018-01-04T00:00:00;2018-01-06T00:00:00;5;455;420;4;40;TRUE
749;eget tincidunt eget tempus vel pede morbi porttitor lorem id ligula suspendisse ornare consequat;dui vel;2018-01-04T00:00:00;2018-01-08T00:00:00;3;517;589;5;51;TRUE
750;blandit nam nulla integer pede justo lacinia eget tincidunt eget tempus vel pede morbi;ac consequat;2018-01-01T00:00:00;2018-01-09T00:00:00;5;980;920;9;94;TRUE
751;vehicula condimentum curabitur in libero ut massa volutpat convallis;curabitur convallis duis consequat;2018-01-02T00:00:00;2018-01-09T00:00:00;2;919;932;9;93;FALSE
752;gravida nisi at nibh in hac;sapien in sapien iaculis congue;2018-01-03T00:00:00;2018-01-11T00:00:00;5;384;303;3;32;FALSE
753;duis consequat dui nec nisi volutpat eleifend donec ut dolor morbi;massa id lobortis convallis;2018-01-02T00:00:00;2018-01-11T00:00:00;5;444;496;4;42;FALSE
754;dui proin leo odio porttitor id consequat in consequat ut nulla sed accumsan felis ut;velit eu est congue;2018-01-02T00:00:00;2018-01-10T00:00:00;5;403;406;4;42;FALSE
755;condimentum id luctus nec molestie sed justo pellentesque viverra pede ac diam cras pellentesque volutpat;nam congue risus semper porta volutpat;2018-01-04T00:00:00;2018-01-08T00:00:00;5;589;568;5;54;FALSE
756;pede lobortis ligula sit;metus vitae ipsum aliquam;2018-01-01T00:00:00;2018-01-10T00:00:00;5;663;668;6;62;FALSE
757;magna ac consequat metus sapien ut nunc vestibulum ante ipsum primis in;nulla neque libero;2018-01-03T00:00:00;2018-01-09T00:00:00;3;269;287;2;24;FALSE
758;in est risus auctor sed tristique;adipiscing elit proin risus;2018-01-01T00:00:00;2018-01-11T00:00:00;5;787;723;7;71;FALSE
759;ante vivamus tortor duis mattis egestas metus;in est;2018-01-04T00:00:00;2018-01-09T00:00:00;1;115;108;1;10;FALSE
760;turpis nec euismod scelerisque quam turpis adipiscing lorem vitae;mauris sit amet;2018-01-04T00:00:00;2018-01-08T00:00:00;5;606;652;6;64;FALSE
761;suspendisse potenti in eleifend quam a odio in hac habitasse;felis fusce posuere felis sed lacus;2018-01-04T00:00:00;2018-01-06T00:00:00;3;575;518;5;52;FALSE
762;consectetuer adipiscing elit proin risus praesent lectus;sollicitudin vitae consectetuer eget;2018-01-02T00:00:00;2018-01-10T00:00:00;1;339;390;3;34;FALSE
763;ullamcorper augue a suscipit nulla elit ac nulla sed vel enim sit amet;in faucibus orci luctus;2018-01-04T00:00:00;2018-01-09T00:00:00;5;636;660;6;60;FALSE
764;lorem ipsum dolor sit amet consectetuer adipiscing elit proin risus praesent lectus;diam cras pellentesque;2018-01-04T00:00:00;2018-01-08T00:00:00;4;802;841;8;84;FALSE
765;phasellus id sapien in sapien;donec vitae nisi nam ultrices;2018-01-03T00:00:00;2018-01-07T00:00:00;4;208;225;2;24;FALSE
766;velit nec nisi vulputate nonummy maecenas tincidunt lacus at velit;nisl ut volutpat sapien arcu sed;2018-01-04T00:00:00;2018-01-11T00:00:00;2;850;821;8;83;FALSE
767;habitasse platea dictumst morbi vestibulum velit id pretium iaculis diam erat fermentum justo;aliquet pulvinar sed nisl nunc rhoncus;2018-01-02T00:00:00;2018-01-07T00:00:00;5;751;744;7;70;FALSE
768;pede venenatis non sodales;sed justo pellentesque viverra pede ac;2018-01-03T00:00:00;2018-01-07T00:00:00;4;825;845;8;83;FALSE
769;vel sem sed sagittis nam congue;blandit mi in porttitor;2018-01-01T00:00:00;2018-01-10T00:00:00;4;308;399;3;32;FALSE
770;felis sed interdum venenatis turpis enim blandit mi;aliquam lacus morbi;2018-01-02T00:00:00;2018-01-10T00:00:00;4;237;284;2;24;FALSE
771;dolor sit amet consectetuer adipiscing elit proin interdum mauris non ligula pellentesque ultrices phasellus;phasellus in felis donec;2018-01-01T00:00:00;2018-01-06T00:00:00;5;526;519;5;50;FALSE
772;rutrum at lorem integer tincidunt ante vel ipsum praesent blandit lacinia erat vestibulum sed magna;ut rhoncus aliquet pulvinar;2018-01-03T00:00:00;2018-01-10T00:00:00;4;945;949;9;93;FALSE
773;parturient montes nascetur ridiculus mus;erat vestibulum sed magna at;2018-01-03T00:00:00;2018-01-08T00:00:00;5;986;961;9;92;FALSE
774;vitae ipsum aliquam non;mi sit amet lobortis sapien sapien;2018-01-02T00:00:00;2018-01-08T00:00:00;3;691;673;6;64;FALSE
775;et ultrices posuere cubilia curae nulla dapibus dolor vel est donec odio justo;fusce posuere felis;2018-01-01T00:00:00;2018-01-08T00:00:00;5;304;372;3;30;FALSE
776;proin risus praesent lectus vestibulum quam;cum sociis natoque;2018-01-03T00:00:00;2018-01-08T00:00:00;3;350;342;3;33;FALSE
777;sit amet consectetuer adipiscing elit proin interdum mauris non ligula pellentesque ultrices phasellus;hendrerit at vulputate vitae nisl aenean;2018-01-03T00:00:00;2018-01-08T00:00:00;5;684;651;6;64;FALSE
778;magna at nunc commodo placerat praesent blandit nam nulla integer pede justo;faucibus orci;2018-01-02T00:00:00;2018-01-07T00:00:00;3;363;374;3;30;FALSE
779;id justo sit amet sapien dignissim vestibulum vestibulum ante ipsum primis in faucibus orci;risus semper porta volutpat quam pede;2018-01-03T00:00:00;2018-01-11T00:00:00;3;391;311;3;33;FALSE
780;quis odio consequat varius integer ac leo pellentesque ultrices mattis odio;accumsan odio;2018-01-04T00:00:00;2018-01-07T00:00:00;4;835;852;8;83;FALSE
781;felis ut at dolor quis odio consequat varius integer ac;duis aliquam convallis nunc proin;2018-01-04T00:00:00;2018-01-11T00:00:00;4;828;852;8;83;FALSE
782;sit amet sapien dignissim vestibulum vestibulum ante ipsum primis in faucibus orci;dapibus at diam nam tristique tortor;2018-01-03T00:00:00;2018-01-07T00:00:00;5;292;278;2;22;FALSE
783;augue vestibulum ante ipsum primis;in lacus curabitur;2018-01-02T00:00:00;2018-01-10T00:00:00;2;940;985;9;90;FALSE
784;nulla ut erat id mauris vulputate elementum nullam varius nulla facilisi cras non velit;nec euismod scelerisque quam turpis adipiscing;2018-01-02T00:00:00;2018-01-11T00:00:00;5;566;507;5;53;FALSE
785;eget eleifend luctus ultricies eu nibh quisque;ante ipsum primis;2018-01-03T00:00:00;2018-01-07T00:00:00;5;741;797;7;70;FALSE
786;a nibh in quis;nunc proin at turpis a pede;2018-01-02T00:00:00;2018-01-06T00:00:00;5;308;302;3;32;FALSE
787;pede venenatis non sodales sed tincidunt eu;quis augue luctus;2018-01-03T00:00:00;2018-01-10T00:00:00;5;562;571;5;51;FALSE
788;ac diam cras pellentesque volutpat;consectetuer eget rutrum at lorem;2018-01-01T00:00:00;2018-01-07T00:00:00;5;877;859;8;82;FALSE
789;quam a odio in hac habitasse platea dictumst maecenas ut massa quis augue luctus;montes nascetur ridiculus mus etiam vel;2018-01-04T00:00:00;2018-01-10T00:00:00;2;796;728;7;71;FALSE
790;orci luctus et ultrices posuere cubilia curae;nisi at nibh in;2018-01-02T00:00:00;2018-01-06T00:00:00;5;801;818;8;80;FALSE
791;sapien quis libero nullam sit amet turpis;sit amet cursus id turpis integer;2018-01-02T00:00:00;2018-01-11T00:00:00;4;118;114;1;10;FALSE
792;diam cras pellentesque volutpat dui maecenas tristique est et tempus semper est quam;nam tristique;2018-01-03T00:00:00;2018-01-07T00:00:00;5;976;966;9;91;FALSE
793;et tempus semper est quam pharetra magna ac consequat metus;duis at;2018-01-01T00:00:00;2018-01-08T00:00:00;1;748;728;7;74;FALSE
794;erat nulla tempus vivamus in felis eu sapien cursus vestibulum proin;curae donec;2018-01-03T00:00:00;2018-01-09T00:00:00;5;877;864;8;80;FALSE
795;id mauris vulputate elementum nullam varius nulla facilisi cras non velit nec nisi vulputate;donec vitae nisi;2018-01-02T00:00:00;2018-01-10T00:00:00;5;958;990;9;90;FALSE
796;ullamcorper augue a suscipit nulla elit ac nulla sed vel enim sit amet;lacinia nisi;2018-01-04T00:00:00;2018-01-08T00:00:00;1;813;860;8;84;FALSE
797;etiam pretium iaculis justo in hac;nisi vulputate nonummy maecenas;2018-01-01T00:00:00;2018-01-07T00:00:00;5;174;126;1;14;FALSE
798;curae donec pharetra magna vestibulum aliquet ultrices erat tortor sollicitudin mi sit amet lobortis sapien;a nibh in;2018-01-02T00:00:00;2018-01-10T00:00:00;5;876;868;8;81;FALSE
799;nulla eget eros elementum;ut suscipit a feugiat et eros;2018-01-04T00:00:00;2018-01-09T00:00:00;5;208;254;2;20;FALSE
800;dictumst aliquam augue quam sollicitudin vitae consectetuer eget rutrum at lorem integer;diam nam;2018-01-03T00:00:00;2018-01-06T00:00:00;3;320;362;3;34;FALSE
801;mi sit amet lobortis sapien sapien non mi integer ac;primis in;2018-01-03T00:00:00;2018-01-08T00:00:00;3;250;240;2;21;TRUE
802;nulla facilisi cras non velit nec;integer aliquet massa id;2018-01-03T00:00:00;2018-01-11T00:00:00;1;863;824;8;82;TRUE
803;ut odio cras mi pede malesuada in imperdiet et commodo vulputate justo in;sem praesent id massa id nisl;2018-01-03T00:00:00;2018-01-07T00:00:00;5;980;910;9;94;TRUE
804;etiam justo etiam pretium iaculis;convallis morbi odio;2018-01-01T00:00:00;2018-01-06T00:00:00;5;850;857;8;83;TRUE
805;dapibus at diam nam tristique;suspendisse potenti;2018-01-02T00:00:00;2018-01-10T00:00:00;4;821;816;8;84;TRUE
806;porttitor lacus at turpis donec posuere metus vitae;eget semper;2018-01-01T00:00:00;2018-01-09T00:00:00;4;134;183;1;11;TRUE
807;leo odio porttitor id consequat in consequat ut nulla;maecenas tristique est et tempus semper;2018-01-01T00:00:00;2018-01-08T00:00:00;3;155;189;1;10;TRUE
808;ligula suspendisse ornare consequat lectus in est;nibh in quis justo maecenas;2018-01-01T00:00:00;2018-01-09T00:00:00;5;842;876;8;84;TRUE
809;nec euismod scelerisque quam turpis adipiscing lorem vitae mattis nibh ligula nec;primis in faucibus orci;2018-01-02T00:00:00;2018-01-08T00:00:00;5;708;718;7;71;TRUE
810;sed augue aliquam erat volutpat in congue etiam justo etiam pretium iaculis justo in;rutrum nulla nunc purus;2018-01-02T00:00:00;2018-01-11T00:00:00;5;457;492;4;42;TRUE
811;eget orci vehicula condimentum curabitur in libero ut massa volutpat convallis morbi odio;at velit eu est congue elementum;2018-01-04T00:00:00;2018-01-09T00:00:00;4;677;682;6;60;TRUE
812;mauris sit amet eros suspendisse accumsan tortor quis turpis sed ante vivamus tortor duis;integer ac;2018-01-02T00:00:00;2018-01-08T00:00:00;5;951;932;9;90;TRUE
813;morbi odio odio elementum eu interdum eu tincidunt in leo maecenas pulvinar lobortis;eget nunc;2018-01-02T00:00:00;2018-01-06T00:00:00;3;480;459;4;41;TRUE
814;eget congue eget semper rutrum nulla nunc purus phasellus in felis;enim lorem;2018-01-03T00:00:00;2018-01-10T00:00:00;5;858;895;8;80;TRUE
815;eros vestibulum ac est lacinia nisi venenatis tristique fusce congue diam id ornare imperdiet sapien;dapibus dolor vel;2018-01-03T00:00:00;2018-01-07T00:00:00;5;583;581;5;52;TRUE
816;commodo vulputate justo in blandit ultrices enim lorem ipsum dolor sit amet consectetuer;ornare imperdiet sapien;2018-01-03T00:00:00;2018-01-07T00:00:00;5;468;442;4;41;TRUE
817;sed interdum venenatis turpis enim blandit mi in porttitor pede justo eu;metus aenean fermentum donec;2018-01-03T00:00:00;2018-01-06T00:00:00;4;970;980;9;90;TRUE
818;quisque porta volutpat erat quisque erat eros viverra eget congue;at turpis a pede;2018-01-02T00:00:00;2018-01-07T00:00:00;5;933;998;9;94;TRUE
819;habitasse platea dictumst etiam faucibus cursus urna ut tellus nulla ut;pede morbi;2018-01-01T00:00:00;2018-01-06T00:00:00;3;320;317;3;32;TRUE
820;vel pede morbi porttitor lorem;vestibulum rutrum rutrum;2018-01-03T00:00:00;2018-01-10T00:00:00;5;770;780;7;72;TRUE
821;mus etiam vel augue vestibulum rutrum rutrum neque aenean auctor gravida sem;lorem vitae;2018-01-02T00:00:00;2018-01-08T00:00:00;2;614;631;6;61;TRUE
822;posuere nonummy integer non velit donec diam neque vestibulum eget;rhoncus aliquam lacus;2018-01-01T00:00:00;2018-01-06T00:00:00;4;161;112;1;10;TRUE
823;imperdiet nullam orci pede;sed vestibulum sit;2018-01-03T00:00:00;2018-01-06T00:00:00;5;415;478;4;43;TRUE
824;mollis molestie lorem quisque ut erat curabitur gravida nisi at nibh in hac habitasse platea;massa quis;2018-01-04T00:00:00;2018-01-06T00:00:00;4;661;622;6;62;TRUE
825;duis faucibus accumsan odio curabitur convallis duis;integer tincidunt ante;2018-01-04T00:00:00;2018-01-06T00:00:00;3;925;979;9;91;TRUE
826;amet erat nulla tempus vivamus in;sodales scelerisque mauris sit;2018-01-02T00:00:00;2018-01-06T00:00:00;5;692;623;6;62;TRUE
827;ac tellus semper interdum mauris ullamcorper purus sit amet nulla quisque arcu libero rutrum;curae nulla dapibus;2018-01-02T00:00:00;2018-01-08T00:00:00;4;422;441;4;42;TRUE
828;orci eget orci vehicula;mauris sit amet eros;2018-01-02T00:00:00;2018-01-10T00:00:00;1;333;391;3;34;TRUE
829;morbi non lectus aliquam sit amet;quis odio consequat varius integer;2018-01-03T00:00:00;2018-01-11T00:00:00;4;235;203;2;22;TRUE
830;sapien arcu sed augue aliquam erat volutpat in congue etiam justo etiam pretium iaculis;at ipsum ac tellus semper interdum;2018-01-04T00:00:00;2018-01-07T00:00:00;5;783;776;7;74;TRUE
831;nec molestie sed justo pellentesque viverra pede ac;ipsum ac tellus semper interdum mauris;2018-01-03T00:00:00;2018-01-08T00:00:00;5;188;174;1;13;TRUE
832;duis mattis egestas metus aenean fermentum donec ut;quis turpis sed ante;2018-01-04T00:00:00;2018-01-11T00:00:00;4;165;169;1;12;TRUE
833;libero quis orci nullam molestie nibh in lectus pellentesque at nulla suspendisse potenti cras;orci luctus et ultrices posuere;2018-01-04T00:00:00;2018-01-10T00:00:00;5;136;118;1;14;TRUE
834;consequat nulla nisl nunc nisl duis bibendum felis sed;sem sed sagittis nam;2018-01-02T00:00:00;2018-01-09T00:00:00;4;642;662;6;62;TRUE
835;libero ut massa volutpat convallis morbi odio odio elementum;imperdiet nullam orci pede venenatis;2018-01-03T00:00:00;2018-01-07T00:00:00;5;126;166;1;10;TRUE
836;mi nulla ac enim;proin leo;2018-01-04T00:00:00;2018-01-08T00:00:00;2;618;627;6;61;TRUE
837;est congue elementum in hac habitasse;tellus nisi;2018-01-01T00:00:00;2018-01-08T00:00:00;5;453;487;4;44;TRUE
838;ipsum aliquam non mauris morbi non lectus aliquam sit amet diam;donec odio;2018-01-04T00:00:00;2018-01-06T00:00:00;2;384;339;3;31;TRUE
839;a odio in hac habitasse platea dictumst maecenas ut massa;venenatis turpis enim;2018-01-01T00:00:00;2018-01-10T00:00:00;4;740;709;7;73;TRUE
840;varius ut blandit non interdum in ante vestibulum ante ipsum primis in;amet nunc viverra dapibus nulla;2018-01-02T00:00:00;2018-01-06T00:00:00;4;759;731;7;70;TRUE
841;ligula vehicula consequat morbi a ipsum integer a nibh in;fusce posuere felis sed;2018-01-02T00:00:00;2018-01-11T00:00:00;5;768;752;7;73;TRUE
842;ultrices libero non mattis pulvinar nulla pede ullamcorper augue a suscipit nulla;pede justo lacinia eget tincidunt eget;2018-01-03T00:00:00;2018-01-11T00:00:00;5;556;510;5;54;TRUE
843;dapibus augue vel accumsan tellus nisi eu orci mauris lacinia;placerat praesent blandit;2018-01-02T00:00:00;2018-01-11T00:00:00;5;958;917;9;90;TRUE
844;justo lacinia eget tincidunt eget tempus vel pede morbi porttitor lorem id;arcu adipiscing;2018-01-03T00:00:00;2018-01-10T00:00:00;5;202;229;2;21;TRUE
845;nulla tempus vivamus in felis eu sapien cursus vestibulum proin eu;mi nulla ac enim in;2018-01-01T00:00:00;2018-01-09T00:00:00;3;418;449;4;44;TRUE
846;sit amet nunc viverra dapibus nulla suscipit ligula in lacus curabitur;viverra dapibus nulla;2018-01-02T00:00:00;2018-01-08T00:00:00;3;936;927;9;91;TRUE
847;justo lacinia eget tincidunt eget tempus;nec sem duis aliquam convallis nunc;2018-01-01T00:00:00;2018-01-07T00:00:00;3;669;653;6;62;TRUE
848;vel nisl duis ac nibh fusce;laoreet ut rhoncus aliquet;2018-01-01T00:00:00;2018-01-06T00:00:00;5;975;900;9;93;TRUE
849;id nulla ultrices aliquet maecenas leo odio;eu nibh quisque id;2018-01-03T00:00:00;2018-01-11T00:00:00;4;566;509;5;54;TRUE
850;vel sem sed sagittis nam congue risus semper porta;suspendisse accumsan tortor quis turpis;2018-01-03T00:00:00;2018-01-11T00:00:00;5;799;797;7;72;FALSE
851;vel est donec odio justo sollicitudin ut suscipit a;pretium iaculis;2018-01-01T00:00:00;2018-01-11T00:00:00;5;649;643;6;61;FALSE
