id;title;memo;start;end;type_id;deal_id;contact_id;app_account_id;agent_id;done
1;sit amet diam in magna bibendum imperdiet nullam orci pede venenatis non;nec dui luctus;2018-02-01T01:00:00;2018-02-01T30:00:00;3;272;266;2;21;FALSE
2;nulla sed vel enim sit amet nunc viverra dapibus nulla suscipit ligula in;ac nibh fusce lacus purus aliquet;2018-01-01T00:00:00;2018-01-10T00:00:00;5;441;408;4;40;FALSE
3;ultrices aliquet maecenas leo odio condimentum id luctus;tincidunt nulla mollis molestie lorem;2018-01-03T00:00:00;2018-01-09T00:00:00;5;536;535;5;51;FALSE
4;semper rutrum nulla nunc purus phasellus in felis;vulputate luctus cum sociis natoque;2018-01-02T00:00:00;2018-01-11T00:00:00;5;402;474;4;43;FALSE
5;donec odio justo sollicitudin ut suscipit a feugiat;morbi sem mauris laoreet;2018-01-03T00:00:00;2018-01-10T00:00:00;5;788;709;7;70;FALSE
6;nulla suspendisse potenti cras in purus eu magna vulputate luctus cum sociis natoque penatibus;lectus suspendisse potenti in eleifend quam;2018-01-02T00:00:00;2018-01-06T00:00:00;5;765;727;7;74;FALSE
7;viverra eget congue eget semper rutrum nulla nunc purus phasellus in felis donec;est congue;2018-01-04T00:00:00;2018-01-11T00:00:00;4;415;461;4;41;FALSE
8;primis in faucibus orci luctus et ultrices posuere cubilia curae duis faucibus;interdum eu tincidunt in leo maecenas;2018-01-01T00:00:00;2018-01-06T00:00:00;4;266;283;2;20;FALSE
9;duis bibendum felis sed interdum venenatis turpis enim blandit mi in porttitor;amet cursus id turpis integer;2018-01-04T00:00:00;2018-01-09T00:00:00;5;461;476;4;42;FALSE
10;ornare imperdiet sapien urna pretium nisl ut volutpat;sed vestibulum sit amet cursus id;2018-01-03T00:00:00;2018-01-10T00:00:00;4;602;635;6;62;FALSE
11;mauris enim leo rhoncus sed;rhoncus sed vestibulum sit;2018-01-03T00:00:00;2018-01-10T00:00:00;4;191;169;1;11;FALSE
12;sed tristique in tempus sit amet sem fusce consequat nulla nisl;luctus et ultrices;2018-01-04T00:00:00;2018-01-10T00:00:00;3;230;226;2;24;FALSE
13;lacus at velit vivamus vel nulla eget eros elementum pellentesque;mi pede malesuada in imperdiet et;2018-01-04T00:00:00;2018-01-08T00:00:00;5;791;767;7;72;FALSE
14;orci nullam molestie nibh in lectus pellentesque at nulla suspendisse potenti cras in;donec semper sapien a libero;2018-01-02T00:00:00;2018-01-10T00:00:00;5;588;586;5;50;FALSE
15;mus etiam vel augue vestibulum rutrum rutrum neque aenean auctor gravida sem praesent id;iaculis congue;2018-01-02T00:00:00;2018-01-07T00:00:00;5;396;374;3;31;FALSE
16;velit vivamus vel nulla eget eros elementum pellentesque quisque porta volutpat erat quisque;sapien cursus vestibulum proin eu mi;2018-01-03T00:00:00;2018-01-08T00:00:00;3;135;147;1;13;FALSE
17;in hac habitasse platea;duis aliquam;2018-01-03T00:00:00;2018-01-10T00:00:00;5;531;539;5;51;FALSE
18;diam cras pellentesque volutpat dui maecenas tristique est et tempus semper est quam pharetra;libero nullam sit amet turpis;2018-01-04T00:00:00;2018-01-11T00:00:00;5;720;742;7;70;FALSE
19;nulla tempus vivamus in felis eu sapien cursus vestibulum proin eu mi nulla;curabitur at ipsum ac tellus;2018-01-02T00:00:00;2018-01-10T00:00:00;5;675;631;6;62;FALSE
20;in hac habitasse platea dictumst aliquam augue quam;fermentum donec;2018-01-01T00:00:00;2018-01-09T00:00:00;5;357;315;3;34;FALSE
21;placerat ante nulla justo aliquam quis turpis eget elit sodales scelerisque mauris sit;tempus sit;2018-01-04T00:00:00;2018-01-06T00:00:00;5;892;881;8;82;FALSE
22;duis faucibus accumsan odio curabitur convallis duis consequat dui nec nisi;posuere cubilia curae;2018-01-01T00:00:00;2018-01-09T00:00:00;4;895;877;8;81;FALSE
23;vel nulla eget eros elementum pellentesque quisque porta volutpat erat quisque erat eros viverra;vitae ipsum;2018-01-04T00:00:00;2018-01-06T00:00:00;2;962;998;9;91;FALSE
24;eu mi nulla ac enim in tempor turpis nec euismod scelerisque quam turpis adipiscing lorem;aliquam sit amet;2018-01-01T00:00:00;2018-01-11T00:00:00;5;389;351;3;31;FALSE
25;sem mauris laoreet ut rhoncus aliquet pulvinar sed nisl nunc rhoncus;viverra eget congue;2018-01-04T00:00:00;2018-01-10T00:00:00;5;466;445;4;40;FALSE
26;non interdum in ante vestibulum;quam nec dui luctus;2018-01-03T00:00:00;2018-01-11T00:00:00;3;301;304;3;30;FALSE
27;velit eu est congue;a odio in hac;2018-01-02T00:00:00;2018-01-09T00:00:00;5;954;915;9;91;FALSE
28;ante vel ipsum praesent blandit lacinia erat;odio consequat varius;2018-01-03T00:00:00;2018-01-06T00:00:00;4;794;778;7;70;FALSE
29;nec euismod scelerisque quam turpis adipiscing lorem vitae mattis;viverra dapibus nulla suscipit;2018-01-01T00:00:00;2018-01-06T00:00:00;5;742;786;7;70;FALSE
30;eros elementum pellentesque quisque porta volutpat;mattis egestas;2018-01-02T00:00:00;2018-01-09T00:00:00;5;891;836;8;81;FALSE
31;diam erat fermentum justo nec;dictumst morbi vestibulum;2018-01-03T00:00:00;2018-01-06T00:00:00;4;297;294;2;24;FALSE
32;sem mauris laoreet ut;sit amet sem fusce consequat;2018-01-01T00:00:00;2018-01-10T00:00:00;5;572;533;5;53;FALSE
33;lacinia aenean sit amet justo morbi ut odio cras mi pede;volutpat in congue;2018-01-02T00:00:00;2018-01-08T00:00:00;1;482;402;4;40;FALSE
34;nullam molestie nibh in lectus pellentesque at nulla suspendisse potenti;interdum in ante;2018-01-02T00:00:00;2018-01-07T00:00:00;4;553;538;5;53;FALSE
35;viverra dapibus nulla suscipit ligula in lacus curabitur at ipsum;donec odio;2018-01-02T00:00:00;2018-01-06T00:00:00;3;739;738;7;70;FALSE
36;nulla sed accumsan felis ut at dolor quis odio consequat varius integer ac leo pellentesque;dis parturient montes nascetur ridiculus mus;2018-01-01T00:00:00;2018-01-06T00:00:00;5;958;967;9;94;FALSE
37;faucibus accumsan odio curabitur convallis duis consequat dui nec;eu magna vulputate luctus;2018-01-01T00:00:00;2018-01-10T00:00:00;2;494;483;4;40;FALSE
38;maecenas rhoncus aliquam lacus morbi quis tortor id nulla ultrices aliquet maecenas leo odio;et commodo vulputate;2018-01-03T00:00:00;2018-01-11T00:00:00;4;554;595;5;50;FALSE
39;nulla facilisi cras non velit nec nisi vulputate nonummy maecenas tincidunt;ultrices erat tortor sollicitudin;2018-01-04T00:00:00;2018-01-10T00:00:00;5;963;992;9;94;FALSE
40;sodales scelerisque mauris sit amet eros suspendisse accumsan tortor quis turpis sed ante vivamus tortor;volutpat sapien arcu sed augue;2018-01-04T00:00:00;2018-01-07T00:00:00;4;633;639;6;63;FALSE
41;sapien arcu sed augue aliquam erat volutpat in congue etiam justo;ultrices enim lorem ipsum dolor sit;2018-01-03T00:00:00;2018-01-11T00:00:00;5;936;936;9;90;FALSE
42;justo eu massa donec dapibus duis at velit eu est congue elementum in hac habitasse;non mattis pulvinar nulla pede ullamcorper;2018-01-03T00:00:00;2018-01-08T00:00:00;4;734;706;7;72;FALSE
43;faucibus orci luctus et ultrices posuere cubilia curae mauris viverra diam vitae;sapien cursus vestibulum;2018-01-03T00:00:00;2018-01-10T00:00:00;5;377;301;3;32;FALSE
44;porta volutpat erat quisque erat eros viverra eget congue eget semper;faucibus orci luctus;2018-01-01T00:00:00;2018-01-09T00:00:00;3;251;223;2;23;FALSE
45;praesent lectus vestibulum quam sapien;ac neque duis;2018-01-03T00:00:00;2018-01-10T00:00:00;4;324;304;3;31;FALSE
46;sollicitudin ut suscipit a feugiat et eros vestibulum;justo in blandit;2018-01-04T00:00:00;2018-01-10T00:00:00;5;475;440;4;42;FALSE
47;purus eu magna vulputate luctus cum sociis natoque penatibus et magnis dis;aenean lectus pellentesque eget nunc;2018-01-03T00:00:00;2018-01-10T00:00:00;5;255;284;2;21;FALSE
48;curae duis faucibus accumsan odio curabitur;blandit non interdum in ante;2018-01-02T00:00:00;2018-01-10T00:00:00;5;264;238;2;23;FALSE
49;aliquet at feugiat non pretium quis lectus suspendisse potenti in eleifend quam a;accumsan tortor quis turpis sed;2018-01-03T00:00:00;2018-01-06T00:00:00;5;899;801;8;82;FALSE
50;posuere nonummy integer non velit donec diam neque vestibulum eget vulputate ut ultrices vel augue;metus sapien;2018-01-04T00:00:00;2018-01-11T00:00:00;3;888;841;8;84;FALSE
51;suspendisse potenti in eleifend quam a odio in hac habitasse platea dictumst maecenas ut massa;suspendisse accumsan tortor quis;2018-01-04T00:00:00;2018-01-11T00:00:00;4;547;570;5;54;FALSE
52;id luctus nec molestie sed justo pellentesque viverra pede ac diam cras;mi sit amet;2018-01-03T00:00:00;2018-01-06T00:00:00;2;185;190;1;10;FALSE
53;nunc proin at turpis a pede;ridiculus mus vivamus;2018-01-01T00:00:00;2018-01-10T00:00:00;5;942;925;9;92;FALSE
54;dui luctus rutrum nulla tellus in sagittis dui vel nisl;vitae consectetuer;2018-01-01T00:00:00;2018-01-10T00:00:00;5;718;793;7;70;FALSE
55;id consequat in consequat ut nulla sed accumsan felis;nisi vulputate nonummy;2018-01-04T00:00:00;2018-01-11T00:00:00;3;555;576;5;52;FALSE
56;purus phasellus in felis;nisi vulputate;2018-01-03T00:00:00;2018-01-08T00:00:00;2;154;107;1;14;FALSE
57;dis parturient montes nascetur;elementum ligula;2018-01-03T00:00:00;2018-01-11T00:00:00;5;356;396;3;30;FALSE
58;nec nisi volutpat eleifend donec ut dolor morbi vel lectus in quam;quisque ut erat curabitur gravida nisi;2018-01-04T00:00:00;2018-01-09T00:00:00;5;627;611;6;61;FALSE
59;congue diam id ornare imperdiet sapien urna pretium nisl ut volutpat;dapibus dolor;2018-01-03T00:00:00;2018-01-11T00:00:00;3;702;729;7;71;FALSE
60;lorem id ligula suspendisse ornare consequat lectus in est risus;ligula vehicula consequat morbi;2018-01-01T00:00:00;2018-01-07T00:00:00;1;806;874;8;84;FALSE
61;molestie nibh in lectus pellentesque at nulla suspendisse potenti cras;congue risus semper porta;2018-01-01T00:00:00;2018-01-06T00:00:00;5;577;588;5;50;FALSE
62;phasellus in felis donec semper sapien;porta volutpat;2018-01-02T00:00:00;2018-01-07T00:00:00;3;371;376;3;34;FALSE
63;pellentesque volutpat dui maecenas tristique est et tempus semper est;vehicula consequat;2018-01-04T00:00:00;2018-01-08T00:00:00;3;222;248;2;20;FALSE
64;vehicula condimentum curabitur in libero ut massa volutpat convallis morbi;molestie nibh in;2018-01-04T00:00:00;2018-01-11T00:00:00;5;606;646;6;63;FALSE
65;ipsum primis in faucibus orci luctus et ultrices;amet nunc viverra dapibus nulla;2018-01-02T00:00:00;2018-01-09T00:00:00;2;699;665;6;64;FALSE
66;odio curabitur convallis duis consequat dui nec nisi volutpat eleifend donec ut;non velit donec;2018-01-03T00:00:00;2018-01-11T00:00:00;1;558;536;5;52;FALSE
67;dignissim vestibulum vestibulum ante ipsum;rhoncus dui vel sem sed;2018-01-03T00:00:00;2018-01-08T00:00:00;5;374;343;3;33;FALSE
68;dictumst aliquam augue quam sollicitudin;quam suspendisse potenti;2018-01-03T00:00:00;2018-01-10T00:00:00;4;725;799;7;72;FALSE
69;erat volutpat in congue;neque libero convallis eget eleifend;2018-01-02T00:00:00;2018-01-08T00:00:00;4;923;917;9;91;FALSE
70;vivamus tortor duis mattis egestas metus;non interdum in ante;2018-01-04T00:00:00;2018-01-07T00:00:00;5;384;331;3;30;FALSE
71;justo lacinia eget tincidunt eget tempus vel pede morbi porttitor lorem id ligula;nisi venenatis tristique fusce;2018-01-04T00:00:00;2018-01-11T00:00:00;5;192;156;1;12;FALSE
72;lobortis vel dapibus at diam;ligula nec sem duis aliquam convallis;2018-01-04T00:00:00;2018-01-10T00:00:00;5;196;191;1;11;FALSE
73;nulla nisl nunc nisl duis bibendum felis;nibh ligula nec sem duis;2018-01-02T00:00:00;2018-01-07T00:00:00;4;862;870;8;83;FALSE
74;pellentesque ultrices mattis odio donec vitae nisi nam ultrices libero non mattis pulvinar nulla;purus eu magna;2018-01-02T00:00:00;2018-01-08T00:00:00;4;148;124;1;13;FALSE
75;pulvinar lobortis est phasellus sit amet erat nulla tempus vivamus in felis eu;maecenas leo odio condimentum id;2018-01-04T00:00:00;2018-01-10T00:00:00;3;328;352;3;34;FALSE
76;vestibulum sed magna at nunc commodo placerat praesent blandit nam nulla integer pede justo lacinia;nulla tellus in sagittis dui vel;2018-01-04T00:00:00;2018-01-07T00:00:00;5;360;300;3;30;FALSE
77;mattis nibh ligula nec sem duis aliquam;diam cras pellentesque volutpat dui maecenas;2018-01-02T00:00:00;2018-01-10T00:00:00;5;634;696;6;63;FALSE
78;commodo placerat praesent blandit nam nulla integer pede justo lacinia;est donec odio justo;2018-01-04T00:00:00;2018-01-11T00:00:00;3;244;237;2;21;FALSE
79;donec ut mauris eget massa tempor convallis nulla neque libero convallis eget eleifend luctus ultricies;risus semper porta volutpat quam;2018-01-01T00:00:00;2018-01-06T00:00:00;5;410;454;4;42;FALSE
80;vulputate elementum nullam varius nulla facilisi cras non velit nec nisi;blandit nam nulla integer pede;2018-01-04T00:00:00;2018-01-10T00:00:00;4;181;198;1;10;FALSE
81;turpis donec posuere metus vitae ipsum aliquam non mauris morbi;sit amet;2018-01-03T00:00:00;2018-01-06T00:00:00;5;883;807;8;84;FALSE
82;at turpis a pede posuere nonummy integer non velit donec diam neque;in lectus pellentesque;2018-01-04T00:00:00;2018-01-10T00:00:00;4;147;140;1;14;FALSE
83;aliquet maecenas leo odio condimentum id luctus nec molestie;vel ipsum praesent;2018-01-04T00:00:00;2018-01-07T00:00:00;3;164;105;1;10;FALSE
84;consectetuer adipiscing elit proin interdum mauris non ligula pellentesque;lectus in;2018-01-02T00:00:00;2018-01-11T00:00:00;4;132;155;1;12;FALSE
85;lacinia erat vestibulum sed magna at nunc commodo placerat praesent blandit nam nulla;consectetuer adipiscing;2018-01-04T00:00:00;2018-01-10T00:00:00;3;922;985;9;91;FALSE
86;luctus ultricies eu nibh quisque id justo sit amet sapien;consectetuer adipiscing elit;2018-01-03T00:00:00;2018-01-09T00:00:00;5;609;634;6;61;FALSE
87;ut erat id mauris;blandit ultrices enim lorem ipsum dolor;2018-01-03T00:00:00;2018-01-07T00:00:00;4;778;799;7;71;FALSE
88;curae duis faucibus accumsan odio curabitur convallis duis consequat dui nec nisi volutpat;vestibulum sed;2018-01-04T00:00:00;2018-01-09T00:00:00;5;611;601;6;61;FALSE
89;placerat praesent blandit nam nulla integer pede justo lacinia eget tincidunt eget tempus;ultrices aliquet maecenas leo odio;2018-01-04T00:00:00;2018-01-11T00:00:00;5;566;562;5;51;FALSE
90;magna at nunc commodo placerat praesent blandit nam nulla integer pede;donec posuere metus vitae ipsum aliquam;2018-01-03T00:00:00;2018-01-08T00:00:00;3;341;339;3;31;FALSE
91;in sapien iaculis congue vivamus metus arcu;varius integer ac;2018-01-01T00:00:00;2018-01-11T00:00:00;5;975;978;9;90;FALSE
92;vel dapibus at diam nam tristique;eget congue eget semper rutrum nulla;2018-01-02T00:00:00;2018-01-09T00:00:00;5;111;119;1;13;FALSE
93;est quam pharetra magna ac consequat;nunc purus phasellus in felis donec;2018-01-01T00:00:00;2018-01-09T00:00:00;4;539;585;5;51;FALSE
94;vel est donec odio justo;quam suspendisse potenti nullam porttitor;2018-01-01T00:00:00;2018-01-10T00:00:00;3;237;221;2;20;FALSE
95;sed augue aliquam erat volutpat;lacinia sapien;2018-01-02T00:00:00;2018-01-09T00:00:00;4;939;979;9;93;FALSE
96;cras non velit nec nisi vulputate nonummy maecenas tincidunt lacus at velit vivamus;ultrices posuere cubilia curae nulla;2018-01-03T00:00:00;2018-01-09T00:00:00;5;271;243;2;22;FALSE
97;sapien quis libero nullam sit amet turpis elementum ligula;ligula in;2018-01-04T00:00:00;2018-01-09T00:00:00;5;361;360;3;33;FALSE
98;pede libero quis orci nullam molestie nibh in;sit amet consectetuer adipiscing;2018-01-03T00:00:00;2018-01-09T00:00:00;1;132;109;1;11;FALSE
99;et commodo vulputate justo in blandit ultrices enim lorem ipsum dolor sit amet;libero convallis eget eleifend luctus;2018-01-04T00:00:00;2018-01-09T00:00:00;5;746;756;7;74;FALSE
100;dui vel nisl duis ac nibh fusce lacus purus aliquet at feugiat non pretium;cum sociis natoque penatibus et magnis;2018-01-01T00:00:00;2018-01-06T00:00:00;3;543;518;5;52;FALSE
101;purus phasellus in felis donec;vulputate vitae nisl;2018-01-02T00:00:00;2018-01-07T00:00:00;5;910;901;9;90;FALSE
102;ante vestibulum ante ipsum primis in faucibus orci luctus et ultrices;sit amet lobortis;2018-01-04T00:00:00;2018-01-10T00:00:00;3;517;595;5;54;FALSE
103;sed sagittis nam congue risus semper porta volutpat quam pede;a suscipit nulla elit ac nulla;2018-01-01T00:00:00;2018-01-06T00:00:00;5;295;204;2;23;FALSE
104;potenti nullam porttitor lacus at turpis donec posuere metus vitae ipsum aliquam non mauris morbi;imperdiet et commodo vulputate;2018-01-04T00:00:00;2018-01-10T00:00:00;4;691;620;6;61;FALSE
105;eget orci vehicula condimentum curabitur in libero ut massa;iaculis congue;2018-01-01T00:00:00;2018-01-09T00:00:00;4;978;978;9;91;FALSE
106;eu nibh quisque id justo sit amet sapien dignissim vestibulum vestibulum ante ipsum primis;turpis integer aliquet massa id;2018-01-04T00:00:00;2018-01-09T00:00:00;5;272;247;2;24;FALSE
107;faucibus orci luctus et ultrices posuere cubilia curae nulla;convallis morbi odio odio elementum;2018-01-04T00:00:00;2018-01-08T00:00:00;5;254;240;2;22;FALSE
108;non mattis pulvinar nulla pede ullamcorper augue a;vivamus metus arcu adipiscing molestie hendrerit;2018-01-02T00:00:00;2018-01-11T00:00:00;5;375;354;3;30;FALSE
109;integer ac leo pellentesque ultrices mattis odio donec vitae nisi nam ultrices libero non;praesent id;2018-01-03T00:00:00;2018-01-10T00:00:00;5;650;627;6;62;FALSE
110;nunc viverra dapibus nulla suscipit ligula in lacus curabitur at ipsum ac tellus semper interdum;morbi vestibulum velit id pretium;2018-01-01T00:00:00;2018-01-10T00:00:00;3;883;884;8;81;FALSE
111;semper interdum mauris ullamcorper purus sit amet nulla quisque;elementum pellentesque quisque porta volutpat;2018-01-03T00:00:00;2018-01-10T00:00:00;4;571;577;5;54;FALSE
112;pretium iaculis diam erat fermentum justo nec condimentum neque;consequat metus sapien ut;2018-01-04T00:00:00;2018-01-06T00:00:00;5;157;188;1;14;FALSE
113;ultrices libero non mattis pulvinar nulla pede ullamcorper augue a suscipit nulla elit;nulla nunc purus;2018-01-03T00:00:00;2018-01-11T00:00:00;5;424;466;4;41;FALSE
114;gravida nisi at nibh in hac habitasse platea dictumst;pellentesque quisque porta volutpat erat;2018-01-03T00:00:00;2018-01-07T00:00:00;5;183;168;1;14;FALSE
115;sapien dignissim vestibulum vestibulum ante ipsum;pellentesque ultrices phasellus id sapien;2018-01-02T00:00:00;2018-01-06T00:00:00;2;286;219;2;20;FALSE
116;nibh ligula nec sem duis aliquam convallis nunc proin at turpis;tincidunt eu felis fusce posuere felis;2018-01-01T00:00:00;2018-01-06T00:00:00;1;314;307;3;33;FALSE
117;in faucibus orci luctus et ultrices posuere cubilia curae nulla dapibus dolor vel est donec;lobortis vel dapibus;2018-01-03T00:00:00;2018-01-11T00:00:00;5;448;416;4;41;FALSE
118;turpis a pede posuere nonummy integer non velit donec diam neque vestibulum eget vulputate;platea dictumst aliquam;2018-01-01T00:00:00;2018-01-08T00:00:00;5;816;826;8;84;FALSE
119;suscipit nulla elit ac nulla sed vel enim sit amet nunc viverra dapibus;vestibulum ante ipsum primis;2018-01-02T00:00:00;2018-01-07T00:00:00;1;167;137;1;10;FALSE
120;mattis nibh ligula nec sem duis aliquam convallis nunc proin at turpis a pede posuere;lacinia nisi;2018-01-01T00:00:00;2018-01-08T00:00:00;5;688;619;6;61;FALSE
121;vivamus vestibulum sagittis sapien cum sociis natoque penatibus;vestibulum eget vulputate ut ultrices vel;2018-01-02T00:00:00;2018-01-10T00:00:00;1;736;755;7;71;FALSE
122;ipsum aliquam non mauris morbi non lectus aliquam;et magnis dis;2018-01-02T00:00:00;2018-01-06T00:00:00;5;101;155;1;12;FALSE
123;consequat ut nulla sed accumsan felis ut at dolor quis;quis justo maecenas rhoncus aliquam;2018-01-02T00:00:00;2018-01-09T00:00:00;5;925;943;9;92;FALSE
124;a ipsum integer a nibh in quis;sapien in sapien iaculis congue;2018-01-03T00:00:00;2018-01-07T00:00:00;5;584;543;5;51;FALSE
125;lacinia eget tincidunt eget;tristique tortor;2018-01-04T00:00:00;2018-01-10T00:00:00;4;602;675;6;63;FALSE
126;turpis eget elit sodales scelerisque mauris sit;at nunc commodo placerat praesent blandit;2018-01-04T00:00:00;2018-01-08T00:00:00;2;279;206;2;20;FALSE
127;consequat dui nec nisi volutpat eleifend donec ut dolor morbi vel lectus in quam;praesent blandit lacinia;2018-01-04T00:00:00;2018-01-08T00:00:00;5;755;719;7;72;FALSE
128;integer ac leo pellentesque ultrices mattis odio donec vitae nisi nam ultrices;aenean fermentum donec ut mauris;2018-01-03T00:00:00;2018-01-09T00:00:00;5;812;807;8;82;FALSE
129;ultricies eu nibh quisque id justo sit amet sapien dignissim;vel dapibus at diam nam tristique;2018-01-04T00:00:00;2018-01-08T00:00:00;3;521;522;5;50;FALSE
130;velit vivamus vel nulla eget;sodales sed;2018-01-02T00:00:00;2018-01-10T00:00:00;4;973;973;9;90;FALSE
131;porttitor id consequat in consequat ut nulla sed accumsan felis ut;id ornare imperdiet;2018-01-01T00:00:00;2018-01-08T00:00:00;4;675;694;6;62;FALSE
132;sed interdum venenatis turpis enim;sem mauris laoreet;2018-01-01T00:00:00;2018-01-11T00:00:00;3;252;241;2;21;FALSE
133;sem sed sagittis nam congue risus semper porta volutpat quam;lectus pellentesque at nulla suspendisse;2018-01-02T00:00:00;2018-01-10T00:00:00;4;154;198;1;11;FALSE
134;mattis pulvinar nulla pede ullamcorper augue a;magna vestibulum aliquet ultrices;2018-01-03T00:00:00;2018-01-06T00:00:00;3;165;170;1;11;FALSE
135;quisque id justo sit amet sapien dignissim vestibulum vestibulum ante ipsum primis in faucibus orci;leo rhoncus sed vestibulum sit;2018-01-02T00:00:00;2018-01-11T00:00:00;3;255;269;2;22;FALSE
136;ridiculus mus etiam vel augue vestibulum rutrum rutrum neque aenean auctor gravida;sollicitudin vitae;2018-01-01T00:00:00;2018-01-09T00:00:00;5;292;279;2;20;FALSE
137;tristique fusce congue diam id ornare imperdiet sapien urna pretium nisl ut volutpat sapien arcu;tempor turpis nec euismod scelerisque;2018-01-03T00:00:00;2018-01-09T00:00:00;5;175;145;1;12;FALSE
138;rutrum nulla tellus in;morbi non lectus aliquam sit amet;2018-01-03T00:00:00;2018-01-10T00:00:00;4;597;555;5;53;FALSE
139;id nulla ultrices aliquet maecenas leo odio;molestie nibh in lectus pellentesque;2018-01-03T00:00:00;2018-01-10T00:00:00;5;113;172;1;13;FALSE
140;integer ac neque duis bibendum morbi;at lorem integer;2018-01-01T00:00:00;2018-01-07T00:00:00;3;869;861;8;83;FALSE
141;semper est quam pharetra magna ac consequat metus sapien ut nunc;pharetra magna ac consequat metus sapien;2018-01-01T00:00:00;2018-01-09T00:00:00;5;442;490;4;40;FALSE
142;turpis elementum ligula vehicula consequat morbi a ipsum integer a nibh;ut erat curabitur gravida;2018-01-04T00:00:00;2018-01-11T00:00:00;5;820;853;8;80;FALSE
143;et magnis dis parturient montes nascetur ridiculus mus etiam vel augue vestibulum rutrum rutrum neque;at vulputate vitae nisl aenean;2018-01-04T00:00:00;2018-01-08T00:00:00;5;354;306;3;32;FALSE
144;id pretium iaculis diam erat fermentum justo nec condimentum neque;integer a nibh in;2018-01-03T00:00:00;2018-01-08T00:00:00;5;570;523;5;51;FALSE
145;fusce congue diam id ornare imperdiet sapien urna pretium nisl ut volutpat sapien;pellentesque ultrices phasellus id sapien;2018-01-02T00:00:00;2018-01-11T00:00:00;5;803;846;8;82;FALSE
146;primis in faucibus orci luctus et ultrices posuere;vulputate ut ultrices vel augue;2018-01-01T00:00:00;2018-01-06T00:00:00;5;491;419;4;41;FALSE
147;ac leo pellentesque ultrices mattis odio donec vitae;sapien ut nunc;2018-01-01T00:00:00;2018-01-06T00:00:00;5;597;570;5;50;FALSE
148;tellus nulla ut erat id mauris vulputate elementum nullam;sapien varius ut;2018-01-01T00:00:00;2018-01-09T00:00:00;2;139;115;1;10;FALSE
149;rutrum nulla nunc purus phasellus in felis donec semper sapien a libero;in blandit ultrices enim;2018-01-03T00:00:00;2018-01-08T00:00:00;5;642;604;6;60;FALSE
150;ante ipsum primis in;eget congue eget semper;2018-01-02T00:00:00;2018-01-08T00:00:00;1;879;843;8;81;FALSE
151;turpis elementum ligula vehicula consequat morbi a ipsum integer a nibh in quis justo;neque aenean;2018-01-03T00:00:00;2018-01-07T00:00:00;4;740;760;7;72;FALSE
152;curae duis faucibus accumsan odio curabitur convallis duis consequat dui nec nisi volutpat eleifend;fermentum donec ut;2018-01-03T00:00:00;2018-01-08T00:00:00;3;738;706;7;73;FALSE
153;id consequat in consequat ut nulla sed accumsan felis ut at dolor quis odio;interdum mauris ullamcorper purus;2018-01-04T00:00:00;2018-01-09T00:00:00;4;955;940;9;93;FALSE
154;est risus auctor sed tristique in;volutpat erat quisque erat;2018-01-01T00:00:00;2018-01-06T00:00:00;5;389;370;3;32;FALSE
155;sapien in sapien iaculis congue;consequat morbi a ipsum integer a;2018-01-02T00:00:00;2018-01-07T00:00:00;3;825;805;8;81;FALSE
156;odio justo sollicitudin ut suscipit a feugiat et;augue a;2018-01-01T00:00:00;2018-01-11T00:00:00;4;886;836;8;80;FALSE
157;nulla ac enim in tempor turpis nec euismod scelerisque quam turpis adipiscing lorem;dapibus augue vel accumsan;2018-01-01T00:00:00;2018-01-09T00:00:00;5;292;225;2;20;FALSE
158;suspendisse potenti cras in purus eu magna;nulla nunc purus phasellus in felis;2018-01-01T00:00:00;2018-01-10T00:00:00;5;604;662;6;60;FALSE
159;orci luctus et ultrices posuere cubilia curae nulla dapibus dolor vel est donec odio;ipsum integer a nibh in quis;2018-01-02T00:00:00;2018-01-09T00:00:00;5;466;458;4;44;FALSE
160;lacus purus aliquet at feugiat non pretium quis lectus suspendisse potenti in eleifend;morbi sem mauris laoreet ut;2018-01-01T00:00:00;2018-01-11T00:00:00;5;933;984;9;90;FALSE
161;primis in faucibus orci luctus et ultrices posuere cubilia;duis bibendum felis sed interdum;2018-01-03T00:00:00;2018-01-08T00:00:00;5;376;329;3;32;FALSE
162;fusce consequat nulla nisl nunc nisl duis bibendum;lacinia aenean sit amet justo;2018-01-03T00:00:00;2018-01-11T00:00:00;5;502;586;5;52;FALSE
163;volutpat in congue etiam justo etiam pretium iaculis justo in hac habitasse platea;dui proin leo odio porttitor id;2018-01-04T00:00:00;2018-01-07T00:00:00;4;491;494;4;42;FALSE
164;dolor quis odio consequat varius integer ac leo pellentesque;pellentesque at nulla suspendisse potenti;2018-01-01T00:00:00;2018-01-11T00:00:00;5;772;746;7;74;FALSE
165;in hac habitasse platea dictumst etiam faucibus cursus urna ut tellus nulla ut;rutrum ac lobortis vel;2018-01-02T00:00:00;2018-01-09T00:00:00;2;768;736;7;73;FALSE
166;mauris enim leo rhoncus sed vestibulum sit amet;tristique est et tempus;2018-01-02T00:00:00;2018-01-11T00:00:00;5;672;625;6;61;TRUE
167;ac enim in tempor turpis;nulla ultrices;2018-01-04T00:00:00;2018-01-06T00:00:00;4;967;927;9;93;TRUE
