id;title;memo;start;end;type_id;deal_id;contact_id;app_account_id;agent_id;done
168;parturient montes nascetur ridiculus mus vivamus vestibulum sagittis sapien cum sociis;vehicula condimentum;2018-01-03T00:00:00;2018-01-07T00:00:00;4;342;320;3;33;TRUE
169;cum sociis natoque penatibus et magnis dis parturient montes nascetur;congue vivamus metus arcu adipiscing molestie;2018-01-03T00:00:00;2018-01-08T00:00:00;4;168;194;1;14;TRUE
170;quis tortor id nulla ultrices aliquet maecenas leo odio condimentum;tellus nulla ut;2018-01-04T00:00:00;2018-01-11T00:00:00;4;363;314;3;32;TRUE
171;nulla nunc purus phasellus in felis donec semper sapien;morbi porttitor lorem;2018-01-02T00:00:00;2018-01-09T00:00:00;5;533;509;5;51;TRUE
172;platea dictumst maecenas ut massa quis augue luctus tincidunt nulla mollis molestie;ipsum ac tellus semper interdum mauris;2018-01-01T00:00:00;2018-01-10T00:00:00;5;543;556;5;51;TRUE
173;sapien sapien non mi integer ac neque duis bibendum morbi non quam nec dui luctus;in est risus auctor sed;2018-01-01T00:00:00;2018-01-11T00:00:00;5;689;661;6;60;TRUE
174;nulla ut erat id mauris vulputate elementum nullam varius nulla;vehicula consequat morbi a ipsum;2018-01-01T00:00:00;2018-01-07T00:00:00;3;292;228;2;21;TRUE
175;tellus in sagittis dui vel nisl duis ac nibh fusce lacus purus;pede venenatis non sodales sed;2018-01-03T00:00:00;2018-01-06T00:00:00;5;460;420;4;40;TRUE
176;in eleifend quam a odio;in lacus curabitur at;2018-01-04T00:00:00;2018-01-08T00:00:00;4;737;791;7;71;TRUE
177;lectus aliquam sit amet;diam cras pellentesque;2018-01-03T00:00:00;2018-01-07T00:00:00;5;112;172;1;13;TRUE
178;libero nullam sit amet turpis elementum ligula vehicula consequat morbi a;placerat praesent blandit nam nulla integer;2018-01-02T00:00:00;2018-01-08T00:00:00;5;339;356;3;31;TRUE
179;odio in hac habitasse platea dictumst maecenas ut massa quis augue luctus;blandit lacinia;2018-01-01T00:00:00;2018-01-07T00:00:00;1;597;545;5;51;TRUE
180;pellentesque at nulla suspendisse potenti cras in;orci nullam molestie nibh in;2018-01-03T00:00:00;2018-01-07T00:00:00;4;639;611;6;60;TRUE
181;cum sociis natoque penatibus et magnis;leo odio condimentum id;2018-01-01T00:00:00;2018-01-07T00:00:00;5;636;671;6;63;TRUE
182;lorem vitae mattis nibh ligula;venenatis non sodales;2018-01-02T00:00:00;2018-01-07T00:00:00;4;404;448;4;42;TRUE
183;hac habitasse platea dictumst etiam faucibus cursus urna ut tellus nulla ut;non mattis pulvinar nulla pede ullamcorper;2018-01-04T00:00:00;2018-01-07T00:00:00;5;491;425;4;44;TRUE
184;quis orci nullam molestie nibh in lectus pellentesque at nulla suspendisse potenti cras in;et ultrices posuere;2018-01-04T00:00:00;2018-01-09T00:00:00;5;249;211;2;20;TRUE
185;cubilia curae nulla dapibus;donec diam neque vestibulum;2018-01-04T00:00:00;2018-01-10T00:00:00;5;174;145;1;14;TRUE
186;et tempus semper est quam pharetra magna ac consequat metus sapien ut nunc vestibulum ante;aliquet at;2018-01-01T00:00:00;2018-01-11T00:00:00;5;596;590;5;50;TRUE
187;non ligula pellentesque ultrices phasellus;condimentum id luctus nec;2018-01-03T00:00:00;2018-01-09T00:00:00;4;785;722;7;70;TRUE
188;nulla tempus vivamus in felis;non mi integer ac neque;2018-01-04T00:00:00;2018-01-07T00:00:00;4;636;686;6;63;TRUE
189;pellentesque ultrices mattis odio donec vitae nisi nam;sed vel enim sit;2018-01-01T00:00:00;2018-01-10T00:00:00;5;951;997;9;90;TRUE
190;nunc nisl duis bibendum felis sed interdum venenatis turpis enim blandit;faucibus orci luctus;2018-01-04T00:00:00;2018-01-10T00:00:00;4;477;406;4;44;TRUE
191;tellus semper interdum mauris ullamcorper purus sit;lectus pellentesque eget nunc donec;2018-01-03T00:00:00;2018-01-10T00:00:00;5;190;103;1;13;TRUE
192;dapibus duis at velit eu est congue;in hac;2018-01-01T00:00:00;2018-01-09T00:00:00;5;387;314;3;30;TRUE
193;cubilia curae donec pharetra magna vestibulum aliquet;vel sem sed;2018-01-01T00:00:00;2018-01-10T00:00:00;5;595;531;5;53;TRUE
194;odio porttitor id consequat;nam nulla integer pede justo lacinia;2018-01-04T00:00:00;2018-01-08T00:00:00;5;705;788;7;73;TRUE
195;ridiculus mus etiam vel augue vestibulum rutrum rutrum neque aenean auctor gravida sem praesent id;congue vivamus;2018-01-03T00:00:00;2018-01-07T00:00:00;3;910;954;9;94;TRUE
196;tellus nisi eu orci mauris lacinia sapien quis libero nullam sit amet;est quam pharetra;2018-01-01T00:00:00;2018-01-10T00:00:00;4;600;612;6;62;TRUE
197;eu interdum eu tincidunt in;leo pellentesque ultrices;2018-01-01T00:00:00;2018-01-07T00:00:00;4;887;807;8;81;TRUE
198;in magna bibendum imperdiet nullam orci pede venenatis non sodales;nulla tellus in sagittis dui vel;2018-01-01T00:00:00;2018-01-08T00:00:00;5;859;823;8;80;TRUE
199;in lacus curabitur at ipsum ac tellus semper interdum mauris ullamcorper purus sit amet nulla;ridiculus mus;2018-01-04T00:00:00;2018-01-10T00:00:00;4;523;572;5;50;TRUE
200;vestibulum ante ipsum primis;mattis nibh ligula;2018-01-04T00:00:00;2018-01-10T00:00:00;5;512;545;5;53;FALSE
201;feugiat non pretium quis lectus suspendisse potenti in eleifend quam a odio in hac;dis parturient montes nascetur ridiculus;2018-01-04T00:00:00;2018-01-08T00:00:00;5;585;579;5;52;FALSE
202;integer pede justo lacinia;congue elementum in;2018-01-04T00:00:00;2018-01-10T00:00:00;5;243;216;2;23;FALSE
203;pulvinar lobortis est phasellus sit amet erat nulla tempus vivamus in felis eu sapien cursus;vivamus metus arcu adipiscing molestie;2018-01-02T00:00:00;2018-01-06T00:00:00;5;847;859;8;82;FALSE
204;diam erat fermentum justo nec condimentum neque sapien placerat;neque vestibulum eget vulputate;2018-01-01T00:00:00;2018-01-08T00:00:00;3;888;813;8;80;FALSE
205;pede ullamcorper augue a suscipit nulla elit ac nulla;curabitur convallis duis consequat;2018-01-01T00:00:00;2018-01-07T00:00:00;5;426;429;4;40;FALSE
206;a ipsum integer a nibh in quis justo maecenas rhoncus aliquam lacus morbi quis tortor;id pretium iaculis diam;2018-01-04T00:00:00;2018-01-10T00:00:00;5;701;749;7;74;FALSE
207;aliquam augue quam sollicitudin vitae consectetuer eget rutrum at;eu orci mauris lacinia sapien;2018-01-04T00:00:00;2018-01-07T00:00:00;1;732;738;7;74;FALSE
208;tempus sit amet sem fusce consequat nulla nisl nunc nisl duis bibendum felis;at velit;2018-01-04T00:00:00;2018-01-09T00:00:00;5;573;568;5;53;FALSE
209;interdum venenatis turpis enim blandit;vel augue vestibulum;2018-01-03T00:00:00;2018-01-08T00:00:00;4;694;627;6;64;FALSE
210;condimentum curabitur in libero ut massa volutpat convallis morbi odio odio;felis donec semper sapien a libero;2018-01-03T00:00:00;2018-01-06T00:00:00;4;572;528;5;54;FALSE
211;nulla suspendisse potenti cras in;ultrices posuere cubilia curae;2018-01-04T00:00:00;2018-01-07T00:00:00;4;304;368;3;34;FALSE
212;nisi volutpat eleifend donec ut dolor morbi vel lectus in;donec diam neque vestibulum;2018-01-01T00:00:00;2018-01-08T00:00:00;5;548;566;5;53;FALSE
213;mauris sit amet eros suspendisse accumsan tortor quis turpis sed ante vivamus tortor duis;sapien iaculis congue vivamus metus arcu;2018-01-02T00:00:00;2018-01-06T00:00:00;4;370;339;3;31;FALSE
214;nunc commodo placerat praesent blandit nam nulla integer pede;in lectus pellentesque;2018-01-01T00:00:00;2018-01-06T00:00:00;1;767;706;7;70;FALSE
215;imperdiet sapien urna pretium nisl ut volutpat sapien;posuere cubilia;2018-01-02T00:00:00;2018-01-10T00:00:00;5;111;120;1;13;FALSE
216;ac neque duis bibendum morbi non quam nec dui luctus rutrum nulla tellus in sagittis;duis ac nibh fusce lacus;2018-01-04T00:00:00;2018-01-10T00:00:00;3;703;787;7;72;FALSE
217;vulputate nonummy maecenas tincidunt;sed tincidunt;2018-01-02T00:00:00;2018-01-08T00:00:00;5;894;841;8;81;FALSE
218;ac diam cras pellentesque;lorem ipsum;2018-01-01T00:00:00;2018-01-08T00:00:00;5;682;663;6;60;FALSE
219;at turpis a pede posuere nonummy integer non velit donec;nulla nunc purus phasellus in;2018-01-03T00:00:00;2018-01-08T00:00:00;1;661;609;6;63;FALSE
220;eget vulputate ut ultrices vel augue vestibulum ante ipsum primis in;ante ipsum primis in faucibus orci;2018-01-01T00:00:00;2018-01-09T00:00:00;5;659;697;6;63;FALSE
221;faucibus orci luctus et ultrices posuere cubilia curae donec pharetra magna vestibulum;lacinia sapien;2018-01-03T00:00:00;2018-01-06T00:00:00;3;489;411;4;43;FALSE
222;elementum ligula vehicula consequat morbi a ipsum integer a nibh in quis justo maecenas rhoncus;aliquet at feugiat non pretium quis;2018-01-03T00:00:00;2018-01-09T00:00:00;4;343;361;3;34;FALSE
223;enim sit amet nunc viverra dapibus nulla suscipit;vitae consectetuer eget rutrum at lorem;2018-01-03T00:00:00;2018-01-10T00:00:00;3;594;573;5;53;FALSE
224;dictumst maecenas ut massa quis augue luctus tincidunt nulla mollis;volutpat in congue etiam justo etiam;2018-01-03T00:00:00;2018-01-07T00:00:00;5;363;399;3;31;FALSE
225;felis sed interdum venenatis turpis;nullam varius nulla facilisi;2018-01-03T00:00:00;2018-01-09T00:00:00;2;306;393;3;32;FALSE
226;accumsan tellus nisi eu orci mauris lacinia sapien quis libero nullam sit amet turpis;vel accumsan tellus nisi eu orci;2018-01-02T00:00:00;2018-01-11T00:00:00;5;441;429;4;41;FALSE
227;donec vitae nisi nam ultrices libero non;adipiscing molestie hendrerit at vulputate;2018-01-02T00:00:00;2018-01-08T00:00:00;5;948;959;9;93;FALSE
228;at ipsum ac tellus semper interdum mauris ullamcorper purus sit;elementum eu interdum eu;2018-01-04T00:00:00;2018-01-06T00:00:00;5;725;776;7;74;FALSE
229;nulla ultrices aliquet maecenas leo odio condimentum id luctus nec molestie sed justo pellentesque;duis consequat dui nec;2018-01-01T00:00:00;2018-01-08T00:00:00;4;117;167;1;13;FALSE
230;accumsan tortor quis turpis sed ante vivamus;luctus nec molestie sed justo;2018-01-01T00:00:00;2018-01-10T00:00:00;5;213;204;2;21;FALSE
231;vel pede morbi porttitor lorem;ultrices vel augue vestibulum ante;2018-01-04T00:00:00;2018-01-10T00:00:00;5;607;658;6;64;FALSE
232;a odio in hac habitasse platea dictumst;blandit mi in porttitor pede;2018-01-03T00:00:00;2018-01-11T00:00:00;4;823;886;8;82;FALSE
233;semper rutrum nulla nunc purus;quam turpis adipiscing;2018-01-03T00:00:00;2018-01-10T00:00:00;4;711;749;7;73;FALSE
234;leo maecenas pulvinar lobortis est phasellus sit amet erat nulla tempus vivamus in felis eu;ut massa volutpat;2018-01-03T00:00:00;2018-01-09T00:00:00;4;917;962;9;94;FALSE
235;eros elementum pellentesque quisque porta volutpat erat quisque erat eros viverra;nibh quisque id justo sit amet;2018-01-02T00:00:00;2018-01-08T00:00:00;4;408;454;4;42;FALSE
236;ipsum primis in faucibus orci luctus et ultrices posuere cubilia;eleifend quam a;2018-01-01T00:00:00;2018-01-11T00:00:00;3;648;623;6;62;FALSE
237;nec condimentum neque sapien placerat ante nulla justo aliquam quis turpis eget elit sodales;tincidunt nulla;2018-01-03T00:00:00;2018-01-07T00:00:00;4;817;884;8;81;FALSE
238;id turpis integer aliquet massa id lobortis convallis tortor risus dapibus augue vel accumsan;pellentesque ultrices mattis odio donec;2018-01-04T00:00:00;2018-01-09T00:00:00;5;496;462;4;43;FALSE
239;turpis elementum ligula vehicula consequat;leo rhoncus sed vestibulum sit amet;2018-01-04T00:00:00;2018-01-10T00:00:00;4;784;791;7;74;FALSE
240;sed lacus morbi sem mauris laoreet ut;amet lobortis sapien sapien;2018-01-01T00:00:00;2018-01-10T00:00:00;5;148;120;1;12;FALSE
241;tempus semper est quam;non interdum in ante vestibulum ante;2018-01-02T00:00:00;2018-01-11T00:00:00;5;762;736;7;73;FALSE
242;neque duis bibendum morbi;nisi volutpat eleifend;2018-01-01T00:00:00;2018-01-11T00:00:00;1;634;651;6;60;FALSE
243;condimentum curabitur in libero ut massa volutpat convallis morbi odio odio elementum eu interdum;nisi at nibh in hac;2018-01-04T00:00:00;2018-01-09T00:00:00;4;863;882;8;82;FALSE
244;pretium quis lectus suspendisse potenti in eleifend quam a odio in;volutpat erat;2018-01-04T00:00:00;2018-01-08T00:00:00;5;495;444;4;43;FALSE
245;in faucibus orci luctus et ultrices posuere cubilia curae donec pharetra;volutpat convallis morbi odio odio elementum;2018-01-03T00:00:00;2018-01-06T00:00:00;5;954;941;9;91;FALSE
246;donec posuere metus vitae ipsum aliquam non mauris morbi non lectus aliquam;sit amet;2018-01-03T00:00:00;2018-01-07T00:00:00;5;136;120;1;12;FALSE
247;quisque erat eros viverra eget congue eget semper rutrum nulla;vitae quam suspendisse;2018-01-02T00:00:00;2018-01-08T00:00:00;5;109;145;1;14;FALSE
248;vestibulum vestibulum ante ipsum primis in;pharetra magna ac consequat metus;2018-01-04T00:00:00;2018-01-11T00:00:00;3;502;586;5;52;FALSE
249;duis faucibus accumsan odio curabitur convallis duis consequat dui nec nisi volutpat eleifend;rutrum at lorem integer tincidunt ante;2018-01-04T00:00:00;2018-01-06T00:00:00;3;305;324;3;33;FALSE
250;nec euismod scelerisque quam turpis adipiscing lorem vitae mattis nibh ligula;at vulputate vitae nisl aenean lectus;2018-01-01T00:00:00;2018-01-06T00:00:00;4;142;104;1;14;TRUE
251;orci luctus et ultrices posuere cubilia curae mauris;montes nascetur ridiculus mus etiam;2018-01-04T00:00:00;2018-01-09T00:00:00;5;264;242;2;24;TRUE
252;pellentesque viverra pede ac diam cras pellentesque;ipsum integer a nibh;2018-01-02T00:00:00;2018-01-09T00:00:00;4;736;748;7;74;TRUE
253;orci luctus et ultrices posuere cubilia curae duis faucibus;justo lacinia;2018-01-03T00:00:00;2018-01-09T00:00:00;3;228;202;2;23;TRUE
254;eros viverra eget congue eget semper rutrum nulla nunc purus phasellus;pulvinar sed nisl nunc rhoncus dui;2018-01-03T00:00:00;2018-01-08T00:00:00;5;227;251;2;23;TRUE
255;faucibus accumsan odio curabitur convallis duis consequat;iaculis congue vivamus metus;2018-01-03T00:00:00;2018-01-07T00:00:00;5;989;922;9;94;TRUE
256;dictumst aliquam augue quam sollicitudin vitae consectetuer eget rutrum;at vulputate vitae nisl aenean;2018-01-03T00:00:00;2018-01-09T00:00:00;4;931;909;9;94;TRUE
257;ac diam cras pellentesque volutpat;bibendum imperdiet nullam orci;2018-01-04T00:00:00;2018-01-09T00:00:00;2;884;802;8;82;TRUE
258;purus aliquet at feugiat non pretium quis lectus suspendisse potenti in eleifend;mattis odio donec vitae;2018-01-04T00:00:00;2018-01-08T00:00:00;3;237;289;2;24;TRUE
259;ipsum dolor sit amet consectetuer adipiscing elit proin interdum mauris non;lorem id ligula suspendisse;2018-01-01T00:00:00;2018-01-11T00:00:00;4;158;106;1;13;TRUE
260;pellentesque eget nunc donec;mauris morbi non lectus aliquam sit;2018-01-02T00:00:00;2018-01-07T00:00:00;4;713;756;7;74;TRUE
261;in faucibus orci luctus et ultrices posuere cubilia curae donec;posuere nonummy integer non velit;2018-01-04T00:00:00;2018-01-10T00:00:00;4;536;592;5;53;TRUE
262;mauris morbi non lectus aliquam sit amet diam in magna bibendum imperdiet nullam;est et tempus;2018-01-03T00:00:00;2018-01-07T00:00:00;4;159;179;1;13;TRUE
263;ultrices posuere cubilia curae duis faucibus accumsan odio curabitur convallis duis;volutpat dui;2018-01-03T00:00:00;2018-01-11T00:00:00;4;263;249;2;20;TRUE
264;dictumst aliquam augue quam sollicitudin vitae consectetuer eget rutrum;eros suspendisse accumsan tortor quis turpis;2018-01-01T00:00:00;2018-01-06T00:00:00;5;345;345;3;32;TRUE
265;erat curabitur gravida nisi;vel dapibus at;2018-01-01T00:00:00;2018-01-11T00:00:00;2;775;731;7;71;TRUE
266;neque vestibulum eget vulputate ut ultrices vel augue vestibulum ante ipsum primis;pede ullamcorper augue a;2018-01-03T00:00:00;2018-01-06T00:00:00;5;871;860;8;82;TRUE
267;in quis justo maecenas rhoncus aliquam lacus morbi quis tortor;turpis a pede posuere nonummy integer;2018-01-01T00:00:00;2018-01-08T00:00:00;4;528;523;5;54;TRUE
268;turpis elementum ligula vehicula consequat morbi a ipsum integer a;integer aliquet massa id lobortis;2018-01-04T00:00:00;2018-01-07T00:00:00;3;498;457;4;40;TRUE
269;eu felis fusce posuere felis sed lacus morbi sem mauris laoreet;magna bibendum imperdiet nullam orci;2018-01-02T00:00:00;2018-01-07T00:00:00;1;555;554;5;51;TRUE
270;dapibus nulla suscipit ligula in lacus curabitur at ipsum;vestibulum sagittis sapien cum sociis;2018-01-03T00:00:00;2018-01-06T00:00:00;4;905;914;9;93;TRUE
271;suscipit ligula in lacus curabitur;turpis elementum ligula vehicula consequat morbi;2018-01-04T00:00:00;2018-01-06T00:00:00;5;149;160;1;13;TRUE
272;aliquam sit amet diam in magna bibendum imperdiet nullam orci pede;arcu sed augue aliquam erat;2018-01-03T00:00:00;2018-01-09T00:00:00;1;793;707;7;74;TRUE
273;in congue etiam justo etiam pretium iaculis justo;porttitor pede justo eu massa donec;2018-01-03T00:00:00;2018-01-07T00:00:00;4;774;744;7;70;TRUE
274;sed vestibulum sit amet cursus id turpis integer aliquet massa id lobortis convallis tortor;luctus nec molestie sed;2018-01-03T00:00:00;2018-01-11T00:00:00;5;678;681;6;62;TRUE
275;primis in faucibus orci luctus;orci vehicula condimentum;2018-01-04T00:00:00;2018-01-08T00:00:00;5;652;689;6;60;TRUE
276;curabitur convallis duis consequat dui nec nisi volutpat eleifend donec ut;vel dapibus at diam;2018-01-01T00:00:00;2018-01-09T00:00:00;4;851;847;8;81;TRUE
277;eleifend donec ut dolor morbi vel;massa id;2018-01-03T00:00:00;2018-01-07T00:00:00;3;804;831;8;82;TRUE
278;ante ipsum primis in faucibus orci luctus et ultrices posuere cubilia curae donec pharetra;lectus pellentesque at nulla suspendisse potenti;2018-01-04T00:00:00;2018-01-10T00:00:00;3;786;735;7;70;TRUE
279;ligula sit amet eleifend pede libero quis orci nullam;vulputate ut ultrices vel;2018-01-02T00:00:00;2018-01-10T00:00:00;5;635;685;6;64;TRUE
280;habitasse platea dictumst maecenas ut massa quis;eget rutrum at lorem;2018-01-04T00:00:00;2018-01-09T00:00:00;5;594;575;5;50;TRUE
281;morbi sem mauris laoreet ut rhoncus aliquet;rutrum rutrum neque aenean auctor gravida;2018-01-02T00:00:00;2018-01-08T00:00:00;4;834;841;8;84;TRUE
282;nulla tempus vivamus in felis eu sapien cursus vestibulum proin eu mi nulla ac;pede ac diam;2018-01-02T00:00:00;2018-01-06T00:00:00;4;464;421;4;42;TRUE
283;rutrum nulla nunc purus;ante vestibulum;2018-01-02T00:00:00;2018-01-06T00:00:00;5;504;507;5;53;TRUE
284;porta volutpat quam pede lobortis ligula sit amet;enim leo rhoncus sed vestibulum sit;2018-01-02T00:00:00;2018-01-07T00:00:00;5;515;582;5;52;TRUE
285;blandit mi in porttitor;vitae mattis;2018-01-04T00:00:00;2018-01-09T00:00:00;5;776;713;7;72;TRUE
286;pharetra magna vestibulum aliquet ultrices erat tortor sollicitudin mi sit amet lobortis;mauris eget massa tempor;2018-01-04T00:00:00;2018-01-06T00:00:00;5;557;517;5;50;TRUE
287;platea dictumst aliquam augue;nulla eget eros;2018-01-02T00:00:00;2018-01-11T00:00:00;5;721;787;7;71;TRUE
288;est et tempus semper est quam pharetra magna ac consequat;libero nullam sit amet turpis;2018-01-04T00:00:00;2018-01-07T00:00:00;5;589;574;5;53;TRUE
289;neque sapien placerat ante;in magna bibendum imperdiet;2018-01-02T00:00:00;2018-01-08T00:00:00;5;615;605;6;61;TRUE
290;erat vestibulum sed magna at nunc commodo placerat praesent blandit nam nulla integer;vel pede;2018-01-01T00:00:00;2018-01-06T00:00:00;3;403;468;4;41;TRUE
291;montes nascetur ridiculus mus vivamus vestibulum sagittis sapien;ipsum praesent blandit lacinia erat vestibulum;2018-01-04T00:00:00;2018-01-11T00:00:00;5;969;995;9;93;TRUE
292;sapien cursus vestibulum proin eu mi nulla;libero nam dui proin leo odio;2018-01-04T00:00:00;2018-01-06T00:00:00;3;236;226;2;24;TRUE
293;non mauris morbi non lectus aliquam sit amet diam in magna bibendum imperdiet;sit amet nunc viverra dapibus nulla;2018-01-04T00:00:00;2018-01-11T00:00:00;5;808;851;8;83;TRUE
294;varius integer ac leo pellentesque ultrices mattis odio donec vitae nisi nam ultrices libero;consectetuer eget rutrum;2018-01-01T00:00:00;2018-01-07T00:00:00;5;966;903;9;93;TRUE
295;sapien iaculis congue vivamus metus arcu adipiscing molestie hendrerit at vulputate;tempor convallis nulla neque;2018-01-04T00:00:00;2018-01-10T00:00:00;5;802;815;8;84;TRUE
296;ac neque duis bibendum morbi non;turpis donec posuere metus vitae ipsum;2018-01-02T00:00:00;2018-01-10T00:00:00;5;388;352;3;33;TRUE
297;ipsum dolor sit amet consectetuer adipiscing elit proin interdum mauris non ligula pellentesque ultrices phasellus;convallis morbi odio odio elementum;2018-01-02T00:00:00;2018-01-07T00:00:00;5;346;394;3;33;TRUE
298;ut mauris eget massa tempor convallis nulla neque;nunc commodo placerat praesent;2018-01-02T00:00:00;2018-01-08T00:00:00;5;471;486;4;44;TRUE
299;diam id ornare imperdiet sapien urna pretium nisl ut volutpat sapien arcu sed augue aliquam;nulla tellus in;2018-01-03T00:00:00;2018-01-06T00:00:00;5;873;810;8;82;TRUE
300;nibh fusce lacus purus aliquet at feugiat non;erat id;2018-01-01T00:00:00;2018-01-10T00:00:00;4;322;347;3;34;TRUE
301;est congue elementum in hac habitasse platea dictumst;tincidunt lacus;2018-01-01T00:00:00;2018-01-11T00:00:00;5;731;779;7;71;FALSE
302;a feugiat et eros vestibulum;cras mi pede malesuada in imperdiet;2018-01-01T00:00:00;2018-01-06T00:00:00;2;597;546;5;52;FALSE
303;hac habitasse platea dictumst aliquam augue quam sollicitudin vitae consectetuer eget rutrum at lorem integer;pede malesuada in imperdiet et;2018-01-04T00:00:00;2018-01-10T00:00:00;5;859;843;8;83;FALSE
304;metus vitae ipsum aliquam non mauris morbi non;magnis dis parturient montes nascetur;2018-01-03T00:00:00;2018-01-06T00:00:00;5;194;101;1;11;FALSE
305;pede ullamcorper augue a suscipit;tristique in tempus;2018-01-02T00:00:00;2018-01-08T00:00:00;5;418;457;4;42;FALSE
306;vel accumsan tellus nisi eu orci mauris lacinia sapien quis libero;lacinia aenean sit amet;2018-01-01T00:00:00;2018-01-06T00:00:00;4;364;383;3;34;FALSE
307;ut suscipit a feugiat et eros vestibulum ac est lacinia nisi venenatis tristique fusce congue;pretium quis lectus suspendisse;2018-01-02T00:00:00;2018-01-11T00:00:00;5;965;962;9;90;FALSE
308;nunc viverra dapibus nulla suscipit ligula in lacus curabitur at ipsum ac tellus semper;sit amet erat nulla;2018-01-01T00:00:00;2018-01-06T00:00:00;1;723;766;7;70;FALSE
309;nulla elit ac nulla sed;felis donec semper sapien;2018-01-04T00:00:00;2018-01-11T00:00:00;5;783;728;7;71;FALSE
310;vestibulum ac est lacinia nisi venenatis tristique fusce congue diam;non sodales;2018-01-04T00:00:00;2018-01-09T00:00:00;5;716;773;7;71;FALSE
311;eget orci vehicula condimentum curabitur in libero ut massa volutpat;imperdiet et commodo;2018-01-03T00:00:00;2018-01-09T00:00:00;2;583;514;5;53;FALSE
312;id ornare imperdiet sapien urna pretium nisl ut volutpat;quisque ut erat curabitur;2018-01-01T00:00:00;2018-01-07T00:00:00;5;307;308;3;32;FALSE
313;nulla quisque arcu libero;consequat ut nulla;2018-01-01T00:00:00;2018-01-08T00:00:00;4;647;611;6;60;FALSE
314;convallis nulla neque libero convallis eget eleifend luctus ultricies eu nibh;pede ac diam;2018-01-02T00:00:00;2018-01-07T00:00:00;5;303;389;3;31;FALSE
315;sed augue aliquam erat volutpat in congue etiam justo etiam pretium;aliquet pulvinar sed;2018-01-04T00:00:00;2018-01-08T00:00:00;5;682;638;6;60;FALSE
316;pede lobortis ligula sit amet;amet eleifend pede libero quis orci;2018-01-04T00:00:00;2018-01-10T00:00:00;4;906;988;9;92;FALSE
317;orci pede venenatis non sodales sed tincidunt eu felis fusce posuere felis sed lacus;molestie nibh in lectus pellentesque at;2018-01-03T00:00:00;2018-01-07T00:00:00;4;622;617;6;60;FALSE
318;vestibulum velit id pretium iaculis diam;etiam justo etiam pretium;2018-01-02T00:00:00;2018-01-10T00:00:00;5;572;538;5;52;FALSE
319;gravida sem praesent id massa id nisl venenatis lacinia aenean sit amet;in quam;2018-01-04T00:00:00;2018-01-09T00:00:00;5;734;798;7;74;FALSE
320;elementum eu interdum eu tincidunt in leo maecenas;facilisi cras non velit nec nisi;2018-01-01T00:00:00;2018-01-09T00:00:00;5;852;850;8;83;FALSE
321;proin risus praesent lectus vestibulum quam sapien varius ut blandit non interdum in ante;neque duis bibendum morbi non quam;2018-01-04T00:00:00;2018-01-10T00:00:00;4;660;624;6;60;FALSE
322;phasellus id sapien in sapien;ut suscipit a feugiat et;2018-01-04T00:00:00;2018-01-11T00:00:00;5;640;686;6;60;FALSE
323;id nisl venenatis lacinia aenean sit amet justo morbi;vel nulla eget eros elementum;2018-01-04T00:00:00;2018-01-11T00:00:00;4;442;465;4;44;FALSE
324;non velit nec nisi vulputate nonummy maecenas tincidunt lacus;nulla mollis molestie lorem;2018-01-02T00:00:00;2018-01-09T00:00:00;4;173;130;1;11;FALSE
325;amet justo morbi ut odio cras mi pede malesuada in imperdiet et commodo vulputate;vivamus in felis eu sapien;2018-01-02T00:00:00;2018-01-11T00:00:00;4;862;873;8;81;FALSE
326;elit ac nulla sed vel enim sit amet;montes nascetur ridiculus mus vivamus vestibulum;2018-01-04T00:00:00;2018-01-11T00:00:00;4;952;933;9;94;FALSE
327;eu felis fusce posuere felis sed lacus morbi sem mauris laoreet ut rhoncus;augue a suscipit nulla elit;2018-01-02T00:00:00;2018-01-08T00:00:00;4;448;427;4;42;FALSE
328;mi integer ac neque;eleifend donec ut dolor morbi vel;2018-01-02T00:00:00;2018-01-10T00:00:00;5;944;952;9;94;FALSE
329;odio elementum eu interdum;lorem quisque;2018-01-03T00:00:00;2018-01-06T00:00:00;5;658;633;6;62;FALSE
330;ultrices posuere cubilia curae mauris viverra diam vitae quam suspendisse potenti nullam;ut blandit non interdum;2018-01-02T00:00:00;2018-01-09T00:00:00;1;788;706;7;74;FALSE
331;vitae nisi nam ultrices libero non;metus sapien;2018-01-01T00:00:00;2018-01-10T00:00:00;1;511;536;5;51;FALSE
332;porta volutpat quam pede lobortis ligula sit amet;mi pede malesuada in imperdiet;2018-01-02T00:00:00;2018-01-11T00:00:00;4;451;453;4;40;FALSE
333;vivamus tortor duis mattis egestas metus aenean fermentum donec;in felis;2018-01-04T00:00:00;2018-01-10T00:00:00;5;882;876;8;82;FALSE
334;massa tempor convallis nulla neque libero convallis eget eleifend luctus;nulla facilisi cras non;2018-01-03T00:00:00;2018-01-06T00:00:00;5;320;349;3;30;FALSE
335;luctus et ultrices posuere cubilia curae duis faucibus accumsan odio curabitur;sapien a;2018-01-01T00:00:00;2018-01-06T00:00:00;5;969;934;9;94;FALSE
336;tristique tortor eu pede;consectetuer eget;2018-01-03T00:00:00;2018-01-11T00:00:00;3;426;432;4;43;FALSE
337;nec euismod scelerisque quam turpis adipiscing lorem vitae;eget nunc donec quis;2018-01-02T00:00:00;2018-01-11T00:00:00;5;124;151;1;10;FALSE
338;semper rutrum nulla nunc;nibh in quis;2018-01-03T00:00:00;2018-01-09T00:00:00;2;831;869;8;84;FALSE
